{"$schema":"https://json-schema.org/draft/2020-12/schema","type":"object","required":["case_id","claim_layer","family","provider_contract","subject_adapter","pre_state","stimulus","expected"],"properties":{"case_id":{"type":"string","minLength":1},"claim_layer":{"type":"string","minLength":1},"family":{"const":"deletion-redaction"},"provider_contract":{"type":"string","minLength":1},"subject_adapter":{"type":"string","minLength":1},"pre_state":{"type":"object","required":["prohibited_data","retained_metadata"],"properties":{"prohibited_data":{"type":"string"},"retained_metadata":{"type":"object"}},"additionalProperties":false},"stimulus":{"type":"object","required":["operation"],"properties":{"operation":{"const":"redact-synthetic-subject"}},"additionalProperties":false},"expected":{"type":"object","required":["post_state"],"properties":{"post_state":{"type":"object","required":["prohibited_data_present","retained_metadata"],"properties":{"prohibited_data_present":{"const":false},"retained_metadata":{"type":"object"}},"additionalProperties":false}},"additionalProperties":false}},"additionalProperties":false}
