{"case_id":"empirical-evaluation-deletion-redaction","claim_layer":"empirical-evaluation","family":"deletion-redaction","provider_contract":"pigloros.fixture.empirical-evaluation@1.0.0","subject_adapter":"exported-artifact","pre_state":{"prohibited_data":"synthetic-secret","retained_metadata":{"record_id":"synthetic-1"}},"stimulus":{"operation":"redact-synthetic-subject"},"expected":{"post_state":{"prohibited_data_present":false,"retained_metadata":{"record_id":"synthetic-1"}}}}
